{
  "source_name": "Brookings Economy",
  "recommended_action": "investigate",
  "reasons": [
    "Zero accepted records across 7 records seen",
    "High filtered ratio (100.0%) suggests source targeting issues",
    "Manual review recommended to assess source relevance"
  ],
  "metrics_snapshot": {
    "accepted_ratio": 0.0,
    "filtered_ratio": 1.0,
    "review_ratio": 0.0
  },
  "created_at": "2026-04-05T01:10:39.292019+00:00"
}